{
  "schemaVersion": 1,
  "name": "Scene Forge / Example Workshop",
  "activeScene": "assetStudio",
  "scenes": {
    "outpost": "scenes/outpost.scene.json",
    "fieldStation": "scenes/fieldStation.scene.json",
    "logistics": "scenes/logistics.scene.json",
    "courtyard": "scenes/courtyard.scene.json",
    "pipePlant": "scenes/pipePlant.scene.json",
    "robotCell": "scenes/robotCell.scene.json",
    "assetStudio": "scenes/assetStudio.scene.json",
    "animationLab": "scenes/animationLab.scene.json"
  },
  "models": {
    "rover": "models/rover.model.json",
    "barrel": "models/barrel.model.json",
    "habitat": "models/habitat.model.json",
    "solar": "models/solar.model.json",
    "cargo": "models/cargo.model.json",
    "landingPad": "models/landingPad.model.json",
    "platform": "models/platform.model.json",
    "fieldStation": "models/fieldStation.model.json",
    "crate": "models/crate.model.json",
    "rack": "models/rack.model.json",
    "windowBay": "models/windowBay.model.json",
    "townhouse": "models/townhouse.model.json",
    "planterTree": "models/planterTree.model.json",
    "parkBench": "models/parkBench.model.json",
    "fountain": "models/fountain.model.json",
    "valve": "models/valve.model.json",
    "vessel": "models/vessel.model.json",
    "pump": "models/pump.model.json",
    "catwalk": "models/catwalk.model.json",
    "gripper": "models/gripper.model.json",
    "robotArm": "models/robotArm.model.json",
    "conveyorRoller": "models/conveyorRoller.model.json",
    "conveyor": "models/conveyor.model.json",
    "controlCabinet": "models/controlCabinet.model.json",
    "guideArrow": "models/guideArrow.model.json",
    "primitiveBox": "models/primitiveBox.model.json",
    "primitiveSphere": "models/primitiveSphere.model.json",
    "primitiveCylinder": "models/primitiveCylinder.model.json",
    "primitiveCone": "models/primitiveCone.model.json",
    "primitiveTorus": "models/primitiveTorus.model.json",
    "primitiveCapsule": "models/primitiveCapsule.model.json",
    "primitivePlane": "models/primitivePlane.model.json",
    "person": "models/person.model.json",
    "astronaut": "models/astronaut.model.json",
    "serviceCharacter": "models/serviceCharacter.model.json",
    "desk": "models/desk.model.json",
    "chair": "models/chair.model.json",
    "mug": "models/mug.model.json",
    "bottle": "models/bottle.model.json",
    "book": "models/book.model.json",
    "sofa": "models/sofa.model.json",
    "tableLamp": "models/tableLamp.model.json",
    "monitor": "models/monitor.model.json"
  }
}
